{
  "schema_version": "1",
  "chokkin_version": "0.6.0",
  "generated_at": "unix:1790578853",
  "issues": [
    {
      "fingerprint": "CHK001:docs/dev/formal/deps_rules_z3.py",
      "code": "CHK001",
      "target": "docs/dev/formal/deps_rules_z3.py"
    },
    {
      "fingerprint": "CHK001:docs/dev/formal/exit_status_z3.py",
      "code": "CHK001",
      "target": "docs/dev/formal/exit_status_z3.py"
    },
    {
      "fingerprint": "CHK001:docs/dev/formal/ignore_model.py",
      "code": "CHK001",
      "target": "docs/dev/formal/ignore_model.py"
    },
    {
      "fingerprint": "CHK001:docs/dev/formal/relative_import_model.py",
      "code": "CHK001",
      "target": "docs/dev/formal/relative_import_model.py"
    },
    {
      "fingerprint": "CHK001:tests/fixtures/deps/binary_dockerfile/src/acme/main.py",
      "code": "CHK001",
      "target": "tests/fixtures/deps/binary_dockerfile/src/acme/main.py"
    },
    {
      "fingerprint": "CHK001:tests/fixtures/deps/binary_gitlab_ci/src/acme/main.py",
      "code": "CHK001",
      "target": "tests/fixtures/deps/binary_gitlab_ci/src/acme/main.py"
    },
    {
      "fingerprint": "CHK001:tests/fixtures/deps/binary_justfile/src/acme/main.py",
      "code": "CHK001",
      "target": "tests/fixtures/deps/binary_justfile/src/acme/main.py"
    },
    {
      "fingerprint": "CHK001:tests/fixtures/deps/binary_makefile/src/acme/main.py",
      "code": "CHK001",
      "target": "tests/fixtures/deps/binary_makefile/src/acme/main.py"
    },
    {
      "fingerprint": "CHK001:tests/fixtures/deps/binary_mkdocs_theme/src/acme/main.py",
      "code": "CHK001",
      "target": "tests/fixtures/deps/binary_mkdocs_theme/src/acme/main.py"
    },
    {
      "fingerprint": "CHK001:tests/fixtures/deps/binary_pdm_scripts/src/acme/main.py",
      "code": "CHK001",
      "target": "tests/fixtures/deps/binary_pdm_scripts/src/acme/main.py"
    },
    {
      "fingerprint": "CHK001:tests/fixtures/deps/binary_pdm_scripts/src/acme/tasks.py",
      "code": "CHK001",
      "target": "tests/fixtures/deps/binary_pdm_scripts/src/acme/tasks.py"
    },
    {
      "fingerprint": "CHK001:tests/fixtures/deps/binary_procfile/src/acme/main.py",
      "code": "CHK001",
      "target": "tests/fixtures/deps/binary_procfile/src/acme/main.py"
    },
    {
      "fingerprint": "CHK001:tests/fixtures/deps/binary_tool_pyproject/src/acme/main.py",
      "code": "CHK001",
      "target": "tests/fixtures/deps/binary_tool_pyproject/src/acme/main.py"
    },
    {
      "fingerprint": "CHK001:tests/fixtures/deps/build_plugin_declared/src/acme/main.py",
      "code": "CHK001",
      "target": "tests/fixtures/deps/build_plugin_declared/src/acme/main.py"
    },
    {
      "fingerprint": "CHK001:tests/fixtures/deps/dev_group_only/src/acme/main.py",
      "code": "CHK001",
      "target": "tests/fixtures/deps/dev_group_only/src/acme/main.py"
    },
    {
      "fingerprint": "CHK001:tests/fixtures/deps/dev_missing/src/acme/main.py",
      "code": "CHK001",
      "target": "tests/fixtures/deps/dev_missing/src/acme/main.py"
    },
    {
      "fingerprint": "CHK001:tests/fixtures/deps/duplicate_requests/src/acme/main.py",
      "code": "CHK001",
      "target": "tests/fixtures/deps/duplicate_requests/src/acme/main.py"
    },
    {
      "fingerprint": "CHK001:tests/fixtures/deps/include_group/src/acme/main.py",
      "code": "CHK001",
      "target": "tests/fixtures/deps/include_group/src/acme/main.py"
    },
    {
      "fingerprint": "CHK001:tests/fixtures/deps/library_lib_package_root/examples/demo.py",
      "code": "CHK001",
      "target": "tests/fixtures/deps/library_lib_package_root/examples/demo.py"
    },
    {
      "fingerprint": "CHK001:tests/fixtures/deps/library_lib_package_root/lib/acme/core.py",
      "code": "CHK001",
      "target": "tests/fixtures/deps/library_lib_package_root/lib/acme/core.py"
    },
    {
      "fingerprint": "CHK001:tests/fixtures/deps/library_without_entry_roots/src/acme/client.py",
      "code": "CHK001",
      "target": "tests/fixtures/deps/library_without_entry_roots/src/acme/client.py"
    },
    {
      "fingerprint": "CHK001:tests/fixtures/deps/library_without_entry_roots/src/tools/gen.py",
      "code": "CHK001",
      "target": "tests/fixtures/deps/library_without_entry_roots/src/tools/gen.py"
    },
    {
      "fingerprint": "CHK001:tests/fixtures/deps/lock_unused_pdm/src/acme/main.py",
      "code": "CHK001",
      "target": "tests/fixtures/deps/lock_unused_pdm/src/acme/main.py"
    },
    {
      "fingerprint": "CHK001:tests/fixtures/deps/lock_unused_poetry/src/acme/main.py",
      "code": "CHK001",
      "target": "tests/fixtures/deps/lock_unused_poetry/src/acme/main.py"
    },
    {
      "fingerprint": "CHK001:tests/fixtures/deps/lock_unused_pylock/src/acme/main.py",
      "code": "CHK001",
      "target": "tests/fixtures/deps/lock_unused_pylock/src/acme/main.py"
    },
    {
      "fingerprint": "CHK001:tests/fixtures/deps/map_alias/src/acme/main.py",
      "code": "CHK001",
      "target": "tests/fixtures/deps/map_alias/src/acme/main.py"
    },
    {
      "fingerprint": "CHK001:tests/fixtures/deps/marker_pywin32/src/acme/main.py",
      "code": "CHK001",
      "target": "tests/fixtures/deps/marker_pywin32/src/acme/main.py"
    },
    {
      "fingerprint": "CHK001:tests/fixtures/deps/misplaced_pytest/src/acme/main.py",
      "code": "CHK001",
      "target": "tests/fixtures/deps/misplaced_pytest/src/acme/main.py"
    },
    {
      "fingerprint": "CHK001:tests/fixtures/deps/missing_yaml/src/acme/main.py",
      "code": "CHK001",
      "target": "tests/fixtures/deps/missing_yaml/src/acme/main.py"
    },
    {
      "fingerprint": "CHK001:tests/fixtures/deps/mypy_plugins_typecheckers/src/acme/main.py",
      "code": "CHK001",
      "target": "tests/fixtures/deps/mypy_plugins_typecheckers/src/acme/main.py"
    },
    {
      "fingerprint": "CHK001:tests/fixtures/deps/optional_missing/src/acme/main.py",
      "code": "CHK001",
      "target": "tests/fixtures/deps/optional_missing/src/acme/main.py"
    },
    {
      "fingerprint": "CHK001:tests/fixtures/deps/optional_try_import/src/acme/main.py",
      "code": "CHK001",
      "target": "tests/fixtures/deps/optional_try_import/src/acme/main.py"
    },
    {
      "fingerprint": "CHK001:tests/fixtures/deps/optional_try_import/src/acme/response.py",
      "code": "CHK001",
      "target": "tests/fixtures/deps/optional_try_import/src/acme/response.py"
    },
    {
      "fingerprint": "CHK001:tests/fixtures/deps/pdm_dev_deps/src/acme/main.py",
      "code": "CHK001",
      "target": "tests/fixtures/deps/pdm_dev_deps/src/acme/main.py"
    },
    {
      "fingerprint": "CHK001:tests/fixtures/deps/pep723_unused_script/src/acme/main.py",
      "code": "CHK001",
      "target": "tests/fixtures/deps/pep723_unused_script/src/acme/main.py"
    },
    {
      "fingerprint": "CHK001:tests/fixtures/deps/platform_guard_import/src/acme/main.py",
      "code": "CHK001",
      "target": "tests/fixtures/deps/platform_guard_import/src/acme/main.py"
    },
    {
      "fingerprint": "CHK001:tests/fixtures/deps/platform_guard_missing/src/acme/main.py",
      "code": "CHK001",
      "target": "tests/fixtures/deps/platform_guard_missing/src/acme/main.py"
    },
    {
      "fingerprint": "CHK001:tests/fixtures/deps/pytest11_venv_plugins/src/acme/main.py",
      "code": "CHK001",
      "target": "tests/fixtures/deps/pytest11_venv_plugins/src/acme/main.py"
    },
    {
      "fingerprint": "CHK001:tests/fixtures/deps/pytest_addopts_plugins/src/acme/main.py",
      "code": "CHK001",
      "target": "tests/fixtures/deps/pytest_addopts_plugins/src/acme/main.py"
    },
    {
      "fingerprint": "CHK001:tests/fixtures/deps/self_extra/src/self_extra/main.py",
      "code": "CHK001",
      "target": "tests/fixtures/deps/self_extra/src/self_extra/main.py"
    },
    {
      "fingerprint": "CHK001:tests/fixtures/deps/transitive_urllib3/src/acme/main.py",
      "code": "CHK001",
      "target": "tests/fixtures/deps/transitive_urllib3/src/acme/main.py"
    },
    {
      "fingerprint": "CHK001:tests/fixtures/deps/transitive_urllib3_optional/src/acme/main.py",
      "code": "CHK001",
      "target": "tests/fixtures/deps/transitive_urllib3_optional/src/acme/main.py"
    },
    {
      "fingerprint": "CHK001:tests/fixtures/deps/transitive_urllib3_pdm/src/acme/main.py",
      "code": "CHK001",
      "target": "tests/fixtures/deps/transitive_urllib3_pdm/src/acme/main.py"
    },
    {
      "fingerprint": "CHK001:tests/fixtures/deps/transitive_urllib3_poetry/src/acme/main.py",
      "code": "CHK001",
      "target": "tests/fixtures/deps/transitive_urllib3_poetry/src/acme/main.py"
    },
    {
      "fingerprint": "CHK001:tests/fixtures/deps/transitive_urllib3_pylock/src/acme/main.py",
      "code": "CHK001",
      "target": "tests/fixtures/deps/transitive_urllib3_pylock/src/acme/main.py"
    },
    {
      "fingerprint": "CHK001:tests/fixtures/deps/unlisted_pytest/src/acme/main.py",
      "code": "CHK001",
      "target": "tests/fixtures/deps/unlisted_pytest/src/acme/main.py"
    },
    {
      "fingerprint": "CHK001:tests/fixtures/deps/unused_boto3/src/acme/main.py",
      "code": "CHK001",
      "target": "tests/fixtures/deps/unused_boto3/src/acme/main.py"
    },
    {
      "fingerprint": "CHK001:tests/fixtures/deps/uv_dev_dependencies_unused/src/acme/main.py",
      "code": "CHK001",
      "target": "tests/fixtures/deps/uv_dev_dependencies_unused/src/acme/main.py"
    },
    {
      "fingerprint": "CHK001:tests/fixtures/deps/uv_path_source/src/acme/main.py",
      "code": "CHK001",
      "target": "tests/fixtures/deps/uv_path_source/src/acme/main.py"
    },
    {
      "fingerprint": "CHK001:tests/fixtures/deps/uv_path_source_member/lib/acme/cli.py",
      "code": "CHK001",
      "target": "tests/fixtures/deps/uv_path_source_member/lib/acme/cli.py"
    },
    {
      "fingerprint": "CHK001:tests/fixtures/deps/uv_tool_constraints/src/acme/main.py",